{
  "$schema": "https://json-schema.org/draft/2020-12/schema",
  "$id": "https://ardur.dev/spec/policy-conformance-bundle-v0.1.schema.json",
  "title": "Ardur Agentic Policy Conformance Bundle v0.1",
  "type": "object",
  "additionalProperties": false,
  "required": [
    "schema_version",
    "bundle_id",
    "evidence_class",
    "claim_boundary",
    "not_claimed",
    "receipt_public_key",
    "scenarios"
  ],
  "properties": {
    "schema_version": {"const": "ardur.policy_conformance_bundle.v0.1"},
    "bundle_id": {"type": "string", "pattern": "^[a-z0-9][a-z0-9._-]{2,127}$"},
    "evidence_class": {"const": "implementation-self-test"},
    "claim_boundary": {"type": "string", "minLength": 1, "maxLength": 2048},
    "not_claimed": {
      "type": "array",
      "minItems": 1,
      "maxItems": 32,
      "uniqueItems": true,
      "items": {"type": "string", "minLength": 1, "maxLength": 256}
    },
    "receipt_public_key": {
      "type": "string",
      "pattern": "^-----BEGIN PUBLIC KEY-----\\n[A-Za-z0-9+/=\\n]+-----END PUBLIC KEY-----\\n$",
      "maxLength": 2048
    },
    "scenarios": {
      "type": "array",
      "minItems": 8,
      "maxItems": 64,
      "items": {"$ref": "#/$defs/scenario"}
    }
  },
  "$defs": {
    "stringArray": {
      "type": "array",
      "maxItems": 64,
      "uniqueItems": true,
      "items": {"type": "string", "minLength": 1, "maxLength": 256}
    },
    "arguments": {
      "type": "object",
      "maxProperties": 64,
      "additionalProperties": {
        "type": ["string", "integer", "number", "boolean", "null", "array", "object"]
      }
    },
    "call": {
      "type": "object",
      "additionalProperties": false,
      "required": ["tool_name", "arguments"],
      "properties": {
        "tool_name": {"type": "string", "minLength": 1, "maxLength": 256},
        "arguments": {"$ref": "#/$defs/arguments"}
      }
    },
    "passportClaims": {
      "type": "object",
      "additionalProperties": false,
      "required": [
        "jti",
        "sub",
        "mission",
        "allowed_tools",
        "forbidden_tools",
        "resource_scope",
        "max_tool_calls",
        "max_duration_s",
        "delegation_allowed",
        "max_delegation_depth"
      ],
      "properties": {
        "jti": {"type": "string", "pattern": "^[A-Za-z0-9._:-]{1,256}$"},
        "sub": {"type": "string", "minLength": 1, "maxLength": 256},
        "mission": {"type": "string", "minLength": 1, "maxLength": 2048},
        "allowed_tools": {"$ref": "#/$defs/stringArray"},
        "forbidden_tools": {"$ref": "#/$defs/stringArray"},
        "resource_scope": {"$ref": "#/$defs/stringArray"},
        "max_tool_calls": {"type": "integer", "minimum": 0, "maximum": 1000000},
        "max_duration_s": {"type": "integer", "minimum": 1, "maximum": 31536000},
        "delegation_allowed": {"type": "boolean"},
        "max_delegation_depth": {"type": "integer", "minimum": 0, "maximum": 16},
        "cwd": {"type": "string", "pattern": "^/", "maxLength": 4096},
        "allowed_side_effect_classes": {
          "type": "array",
          "uniqueItems": true,
          "items": {"enum": ["none", "internal_write", "external_send", "state_change"]}
        }
      }
    },
    "delegationRequest": {
      "type": "object",
      "additionalProperties": false,
      "required": [
        "child_agent_id",
        "child_allowed_tools",
        "child_mission",
        "child_ttl_s",
        "child_max_tool_calls",
        "child_resource_scope"
      ],
      "properties": {
        "child_agent_id": {"type": "string", "minLength": 1, "maxLength": 256},
        "child_allowed_tools": {"$ref": "#/$defs/stringArray"},
        "child_mission": {"type": "string", "minLength": 1, "maxLength": 2048},
        "child_ttl_s": {"type": "integer", "minimum": 1, "maximum": 31536000},
        "child_max_tool_calls": {"type": "integer", "minimum": 1, "maximum": 1000000},
        "child_resource_scope": {"$ref": "#/$defs/stringArray"},
        "child_cwd": {"type": "string", "pattern": "^/", "maxLength": 4096}
      }
    },
    "provenance": {
      "type": "object",
      "additionalProperties": false,
      "required": ["content_class", "source", "sensitivity", "instruction_bearing"],
      "properties": {
        "content_class": {"type": "string", "pattern": "^[a-z][a-z0-9_-]{1,63}$"},
        "source": {"type": "string", "pattern": "^[a-z][a-z0-9._:-]{1,127}$"},
        "sensitivity": {
          "enum": ["public", "internal", "confidential", "restricted", "regulated", "unknown"]
        },
        "instruction_bearing": {"type": "boolean"}
      }
    },
    "scenario": {
      "type": "object",
      "additionalProperties": false,
      "required": [
        "scenario_id",
        "description",
        "risk_class",
        "policy_path",
        "provenance",
        "passport_claims",
        "setup_calls",
        "action",
        "expected",
        "receipt_jwt"
      ],
      "properties": {
        "scenario_id": {"type": "string", "pattern": "^[A-Z][A-Z0-9-]{2,95}$"},
        "description": {"type": "string", "minLength": 1, "maxLength": 1024},
        "risk_class": {"type": "string", "pattern": "^[a-z][a-z0-9_]{1,63}$"},
        "policy_path": {"enum": ["native", "derive_child_passport"]},
        "provenance": {"$ref": "#/$defs/provenance"},
        "passport_claims": {"$ref": "#/$defs/passportClaims"},
        "setup_calls": {
          "type": "array",
          "maxItems": 32,
          "items": {"$ref": "#/$defs/call"}
        },
        "action": {"$ref": "#/$defs/call"},
        "delegation_request": {"$ref": "#/$defs/delegationRequest"},
        "expected": {
          "type": "object",
          "additionalProperties": false,
          "required": ["decision", "reason_code"],
          "properties": {
            "decision": {"enum": ["PERMIT", "DENY"]},
            "reason_code": {"type": "string", "pattern": "^[a-z][a-z0-9_]{1,63}$"}
          }
        },
        "receipt_jwt": {
          "type": "string",
          "pattern": "^[A-Za-z0-9_-]+\\.[A-Za-z0-9_-]+\\.[A-Za-z0-9_-]+$",
          "maxLength": 65536
        }
      },
      "allOf": [
        {
          "if": {"properties": {"policy_path": {"const": "derive_child_passport"}}},
          "then": {"required": ["delegation_request"]},
          "else": {"not": {"required": ["delegation_request"]}}
        }
      ]
    }
  }
}
